<?xml version="1.0" encoding="UTF-8"?>
<Zalba xmlns="http://www.ftn.uns.ac.rs/zalbacutanje"
 xmlns:xsi="http://www.w3.org/2001/XMLSchema-instance"
 xsi:schemaLocation="http://www.ftn.uns.ac.rs/zalbacutanje file:/C:/Users/Luka/Documents/Workspace/XML%20i%20web%20servisi/XML_Web_Servisi/Dokumenti/XML%20Seme/zalbacutanjecir.xsd"
 xmlns:pred="http://examples/predicate/"
 vocab="http://examples/predicate/"
 about="http://ZalbaNaCutanje/1"
    >
    <Poverenik>
        <Adresa>
            <Mesto>Beograd</Mesto>
            <Postanski_broj>11000</Postanski_broj>
            <Ulica>Bulevar kralja Aleksandra</Ulica>
            <Broj>15</Broj>
        </Adresa>
        <Naziv>Poverenik za informacije od javnog znacaja i zastitu podataka o licnosti</Naziv>
    </Poverenik>
    <Naziv_organa property="pred:nazivOrgana">Ministarstvo finansija</Naziv_organa>
    <Razlog_zalbe property="pred:razlogZalbe">Organ vlasti nije postupio u zakonskom roku</Razlog_zalbe>
    <Trazene_informacije_o_zahtevu>
        <Datum_podnosenja property="pred:datumZahteva" >2020-01-03</Datum_podnosenja>
        <Podaci_o_zahtevu_i_informacijama property="pred:tekstZahteva" >Zahtevane su informacije o realizaciji budzeta drzave Srbije</Podaci_o_zahtevu_i_informacijama>
    </Trazene_informacije_o_zahtevu>
    <Datum_podnosenja_zalbe property="pred:datumZalbe">2020-05-04</Datum_podnosenja_zalbe>
    <Podnosilac_zalbe>
        <Adresa>
            <Mesto>Subotica</Mesto>
            <Postanski_broj>24000</Postanski_broj>
            <Ulica>Josipa Krasa</Ulica>
            <Broj>7</Broj>
        </Adresa>
        <Ime property="pred:imeGradjanina">Luka</Ime>
        <Prezime property="pred:prezimeGradjanina">Nikolic</Prezime>
        <Ostali_kontakt_podaci>kucni tel: 024/542-533</Ostali_kontakt_podaci>
    </Podnosilac_zalbe>
</Zalba>
